,created_at,text,Polarity,Subjectivity,Aggregate Score
result_type,2020-03-29 09:54:56,"#Tesla leads the way to a clean #sustainable future. #solarenergy roofing, battery storage and electric vehicles ar https://t.co/Tygx7YWHwy",0.18333333333333335,0.41250000000000003,0.2979166666666667
result_type,2020-03-29 09:51:24,The Corona Convoy at Anthony Henday #COVID19AB #tesla #tocalberta https://t.co/0dYJDniuyL,0.0,0.0,0.0
result_type,2020-03-29 09:50:49,I LOVE this new release from @RoseBartu. Who else thinks this should be the new #Tesla theme song? https://t.co/d9EEfZkE0c,0.25757575757575757,0.503030303030303,0.3803030303030303
result_type,2020-03-29 09:49:47,"So #Tesla is giving all the ventilators away for free, which they already bought and imported and shipped to where they are need",0.4,0.8,0.6000000000000001
result_type,2020-03-29 09:46:31,"So #Tesla is giving all the ventilators away for free, which they already bought and imported and shipped to where they are need",0.4,0.8,0.6000000000000001
result_type,2020-03-29 09:46:05," @Tesla : Warren Buffett has the cash to buy Tesla, Starbucks, or McDonald's https://t.co/1IOCXbc71C $TSLA https://t.co/X94YgWtH08",0.0,0.0,0.0
result_type,2020-03-29 09:45:02,"Warren Buffett has the cash to buy Tesla, Starbucks, or McDonald's : https://t.co/TcYIYQIEJw #Tesla Comments: https://t.co/BwqjbNbTuA",0.0,0.0,0.0
result_type,2020-03-29 09:44:37,"""Wine is the only artwork you can drink"" - Luis Fernando Olaverri.#Tesla #wine #photography #SaturdayVibes https://t.c",0.0,1.0,0.5
result_type,2020-03-29 09:44:34,"Go check your cars, just checked software and the 2020.8.2 update was there waiting. Does anyone ever actually get phone",0.0,0.1,0.05
result_type,2020-03-29 09:43:27,"WOW!  Warren Buffett's Berkshire Hathaway has the cash to buy #Tesla, #Starbucks, or #McDonald's after the https://t.co/mCCvYTLal3",0.125,1.0,0.5625
result_type,2020-03-29 09:42:24,I got three new albums this weekend.  One is #Mother by #InThisMoment.  Another is #Tesla's #FiveManLondonJam.  And https://t.co/F1uPh3Agl5,0.13636363636363635,0.45454545454545453,0.2954545454545454
result_type,2020-03-29 09:41:44,New age companies #Tesla and biotech firms #Moderna defy #COVID19 downfall. https://t.co/4W2pLumsl0#MarkazResearch #Marm,0.13636363636363635,0.45454545454545453,0.2954545454545454
result_type,2020-03-29 09:38:07,"Our latest episode is all about #Tesla safety, with special guest #frunkpuppy Earl AKA @28delayslater (we recorded 28 da",0.4285714285714286,0.7357142857142858,0.5821428571428572
result_type,2020-03-29 09:37:43,"This is my Tesla. There are many like it, but this one is mine. .  #Tesla @28delayslater  @thirdrowtesla https://t.c",0.5,0.5,0.5
result_type,2020-03-29 09:37:33,"So #Tesla is giving all the ventilators away for free, which they already bought and imported and shipped to where they are need",0.4,0.8,0.6000000000000001
result_type,2020-03-29 09:35:36,Tesla Cybertruck Wins The Hearts Of Customers Around The World  $TSLA #Tesla #Cybertruck https://t.co/aL43IAAWEj,0.3,0.2,0.25
result_type,2020-03-29 09:30:11,"#Norwegians and #Tesla , it's a love hate relationship https://t.co/MVKDs6XBJ9 #TechJunkieInvest #TechJunkieNews https://t.co/XywrY6LUkY",-0.15000000000000002,0.75,0.3
result_type,2020-03-29 09:28:36,"So #Tesla is giving all the ventilators away for free, which they already bought and imported and shipped to where they are need",0.4,0.8,0.6000000000000001
result_type,2020-03-29 09:27:30,@vincent13031925 Here was the result for #Tesla #Cybertruck from launch day last year!https://t.co/5HDAu2qBSs,0.0,0.06666666666666667,0.03333333333333333
result_type,2020-03-29 09:27:26,"""I think it is possible for an ordinary person to choose to be extraordinary.""               -- Elon Musk Lets fo https://t.co/PjzGItHMZZ",0.027777777777777773,0.8333333333333334,0.4305555555555556
result_type,2020-03-29 09:24:45,"This is my Tesla. There are many like it, but this one is mine. .  #Tesla @28delayslater  @thirdrowtesla https://t.c",0.5,0.5,0.5
result_type,2020-03-29 09:23:07,Step 1: FSD won't happen.Step 2: That Tesla driving itself on the highway is kinda convenient. FSD still decades a https://t.co/Ipghg5yX3q,0.0,0.0,0.0
result_type,2020-03-29 09:20:30,#electric Links to ELECTRIC VEHICLES #cars #trucks #planes #scooters #vehicles #Teslahttps://t.co/iCLest9Liy,0.0,0.0,0.0
result_type,2020-03-29 09:20:12,#future FOCUS ON THE FUTURE #technology #ElonMusk #Tesla #Amazon #citiesofthefuturehttps://t.co/XGQAoB9kcH,0.0,0.125,0.0625
result_type,2020-03-29 09:16:36,Anyone wanna drive a #cybertruck in Germany? I cant wait. #tesla #ev #pickup https://t.co/QmQ2IwmULW,0.0,0.0,0.0
result_type,2020-03-29 09:14:54,"New video: ""#Tesla Fairly Valued Again at $500, Still Likely to go to $1500"" https://t.co/Oh2cFxVhlN $TSLA #Stocks #Invest",0.27878787878787875,0.7848484848484848,0.5318181818181817
result_type,2020-03-29 09:14:29,About https://t.co/1Ma7Lssy1h and https://t.co/fz1FhvVFFp:So how does Explys k-virus communication channel actual https://t.co/bVqqglOFYE,0.0,0.1,0.05
result_type,2020-03-29 09:12:02,$tsla #tesla Short Szenario under 504 . Whats your opinion for monday next week. https://t.co/mh45lbRHpS,0.0,0.15,0.075
result_type,2020-03-29 09:06:00,"How to change the world:1- Have a grand vision2- Start by laying the first brick 3- Never, ever, give up on that v",0.375,0.6666666666666666,0.5208333333333333
result_type,2020-03-29 09:05:43,The Model Y off-roading through a river will it make it? Follow for more! #tesla #modelY #offroading #suv #cars #carso,0.625,0.5,0.5625
result_type,2020-03-29 09:05:35,"This is my Tesla. There are many like it, but this one is mine. .  #Tesla @28delayslater  @thirdrowtesla https://t.c",0.5,0.5,0.5
result_type,2020-03-29 09:05:01,Tesla Cybertruck Wins The Hearts Of Customers Around The World  $TSLA #Tesla #Cybertruck https://t.co/aL43IAAWEj,0.3,0.2,0.25
result_type,2020-03-29 09:03:46,One of the best decisions I have ever made: getting my #Tesla #Model3  - @CleanElectrCast and @thirdrowtesla helpe https://t.co/myUntnMy4i,1.0,0.3,0.65
result_type,2020-03-29 09:03:38,New age companies #Tesla and biotech firms #Moderna defy #COVID19 downfall. https://t.co/4W2pLumsl0 https://t.co/UmdJliPtE0,0.13636363636363635,0.45454545454545453,0.2954545454545454
result_type,2020-03-29 09:00:54,There are only around 50 salares located within the Antofallos-Pocitos volcanic rift valley in the high Andean plai https://t.co/rH5P2vFHKD,0.08,0.77,0.425
result_type,2020-03-29 09:00:38,VIA  @techlector: (Tesla) Autopilot cars will detect traffic lights? Yes!More Details Here= https://t.co/oDqCj5zzz6#Cars,-0.75,1.0,0.125
result_type,2020-03-29 09:00:15,"#Tesla is furloughing workers, as are other automakers. What does this mean to the price, and the value, of the sto https://t.co/s8sZYXhj0Z",-0.21875,0.53125,0.15625
result_type,2020-03-29 08:57:20,@CDMRawles @sdmoores @benchmarkmin How do you class the #cobaltfree batteries recently sourced from #CATL by #TESLA for #gigashanghai Tier1?,0.0,0.25,0.125
result_type,2020-03-29 08:55:22,"So #Tesla is giving all the ventilators away for free, which they already bought and imported and shipped to where they are need",0.4,0.8,0.6000000000000001
result_type,2020-03-29 08:53:36,The Corona Convoy at Anthony Henday #COVID19AB #tesla #tocalberta https://t.co/0dYJDniuyL,0.0,0.0,0.0
result_type,2020-03-29 08:52:41,"So #Tesla is giving all the ventilators away for free, which they already bought and imported and shipped to where they are need",0.4,0.8,0.6000000000000001
result_type,2020-03-29 08:50:02,VIA  @techlector: (Tesla) Autopilot cars will detect traffic lights? Yes!More Details Here= https://t.co/oDqCj5zzz6 https://t.co/bRjjeGArwS,-0.75,1.0,0.125
result_type,2020-03-29 08:48:16,Hey @AOC jus a small idea to start THE GEEEN NEW DEAL... why are we relying on disposable options? #AOC @Tesla https://t.co/JniXjd4e5E,-0.05681818181818182,0.42727272727272725,0.1852272727272727
result_type,2020-03-29 08:48:14,Tesla Cybertruck Wins The Hearts Of Customers Around The World  $TSLA #Tesla #Cybertruck https://t.co/aL43IAAWEj,0.3,0.2,0.25
result_type,2020-03-29 08:47:01,"One of my favorite photos of #TESLA from their show in Morristown, NJ 9/11/19 - you can see the passion in Jeff Keith's",0.5,1.0,0.75
result_type,2020-03-29 08:44:22,"Plant Shutdowns, Vital Truckers, and More Car News This Weekhttps://t.co/iy3ALlGhLz#news #tech #computer #game https://t.co/HLrMzCzNk6",0.06666666666666665,0.43333333333333335,0.25
result_type,2020-03-29 08:43:11,(Tesla) Autopilot cars will detect traffic lights? Yes!More Details Here= https://t.co/oiEULEQnUb#Cars #Tesla https://t.co/kdDBr3E6cQ,0.0,0.0,0.0
result_type,2020-03-29 08:42:16,There are only around 50 salares located within the Antofallos-Pocitos volcanic rift valley in the high Andean plain. Giant,-0.013571428571428568,0.7242857142857143,0.35535714285714287
result_type,2020-03-29 08:39:50,"So #Tesla is giving all the ventilators away for free, which they already bought and imported and shipped to where they are need",0.4,0.8,0.6000000000000001
result_type,2020-03-29 08:37:20,"New video: ""#Tesla Fairly Valued Again at $500, Still Likely to go to $1500"" https://t.co/Oh2cFxVhlN $TSLA #Stocks https://t.co/HlmRT2MQh7",0.27878787878787875,0.7848484848484848,0.5318181818181817
result_type,2020-03-29 08:37:14,I know you already know about HEPA filtration and long-lasting batteries  #Masks4All #GreenNewDeal #CoronaUpdate https://t.co/hQAyvhHCLm,0.0,0.0,0.0
result_type,2020-03-29 08:37:06,Via @shanef3d - need this toy now!  #cybertruck #tesla https://t.co/vTBQmcdasq,0.0,0.0,0.0
result_type,2020-03-29 08:36:22,Im on my way to the shopping mall in Dubai to buy 2 @Tesla Cybertrucks.  @elonmusk r there any discounts for two or m,0.0,0.0,0.0
result_type,2020-03-29 08:36:07,"Hey @Tesla thank you for your work on the respirator issue! But would you consider for our frontline worker, redesi https://t.co/vQTbMorb55",0.0,0.0,0.0
result_type,2020-03-29 08:33:26,There are only around 50 salares located within the Antofallos-Pocitos volcanic rift valley in the high Andean plain. Giant,-0.013571428571428568,0.7242857142857143,0.35535714285714287
result_type,2020-03-29 08:33:12,"Lets make #Batteries NOT bombs. #Oil Is Still Big, Actually, It's Very Big. But Thanks To #rEVolution Energy Security Is N",0.06666666666666667,0.14333333333333334,0.10500000000000001
result_type,2020-03-29 08:32:59,Building The Green Energy Metals Royalty And Gold Company: Powered by #Gold and #Tesla Energy #rEVolution - #TNRGold $TNR.v,-0.2,0.3,0.04999999999999999
result_type,2020-03-29 08:30:50,"""Ability to stream YouTube &amp; Netflix when car is stopped within a year or two. I'd say 2021 for sure. For only $1.""#Tes",0.25,0.9444444444444444,0.5972222222222222
result_type,2020-03-29 08:30:30,"MIC Tesla Model 3 is going to outnumber imported one very soon. China is returning back to normal, I wish all of my frie",0.11666666666666665,0.31666666666666665,0.21666666666666665
result_type,2020-03-29 08:29:19,"@p_ferragu @p_ferragu $TSLA Q1 # ~114,500, per prior annual data#Tesla had made 1M EVs, by 3/9.Of that899,494 by EY2019100,",0.0,0.0,0.0
result_type,2020-03-29 08:27:48,"This is my Tesla. There are many like it, but this one is mine. .  #Tesla @28delayslater  @thirdrowtesla https://t.c",0.5,0.5,0.5
result_type,2020-03-29 08:27:42,VIDEO: Inside The High-Tech TESLA Factory | Mind Blowing Facts https://t.co/CZg4zqqtjR This high tech TESLA factory is,0.16,0.5399999999999999,0.35
result_type,2020-03-29 08:26:04,"This is my Tesla. There are many like it, but this one is mine. .  #Tesla @28delayslater  @thirdrowtesla https://t.c",0.5,0.5,0.5
result_type,2020-03-29 08:26:02,The Corona Convoy at Anthony Henday #COVID19AB #tesla #tocalberta https://t.co/0dYJDniuyL,0.0,0.0,0.0
result_type,2020-03-29 08:23:22,$tsla #tesla Short Szenario under 504 . Whats your opinion for monday next week. https://t.co/mh45lbRHpS,0.0,0.15,0.075
result_type,2020-03-29 08:22:43,"This is my Tesla. There are many like it, but this one is mine. .  #Tesla @28delayslater  @thirdrowtesla https://t.c",0.5,0.5,0.5
result_type,2020-03-29 08:13:01,Volkswagen ID.3 Cost Compared With Combustion Engine Car https://t.co/JUPlQXdG4u #ElectricVehicles #Tesla #EV #Renewables #C,0.0,0.0,0.0
result_type,2020-03-29 08:12:50,VW I.D. 4 Spied In Sweden With Opel Grille Isnt Fooling Anyone https://t.co/E3iwZQCvGV #ElectricVehicles #Tesla #EV #Renewa,0.0,0.0,0.0
result_type,2020-03-29 08:12:16,Volkswagen ID.3 Cost Compared With Combustion Engine Car https://t.co/JUPlQXdG4u #ElectricVehicles #Tesla #EV #Renewables #C,0.0,0.0,0.0
result_type,2020-03-29 08:11:58,VW I.D. 4 Spied In Sweden With Opel Grille Isnt Fooling Anyone https://t.co/E3iwZQCvGV #ElectricVehicles #Tesla #EV #Renewa,0.0,0.0,0.0
result_type,2020-03-29 08:10:44,Took our @Tesla #ModelY off road today! @elonmusk @ElectrekCo #tesla #model3 #TSLA @28delayslater @bonnienorman @danahull,0.0,0.0,0.0
result_type,2020-03-29 08:09:42,The Corona Convoy at Anthony Henday #COVID19AB #tesla #tocalberta https://t.co/0dYJDniuyL,0.0,0.0,0.0
result_type,2020-03-29 08:07:29,The Corona Convoy at Anthony Henday #COVID19AB #tesla #tocalberta https://t.co/0dYJDniuyL,0.0,0.0,0.0
result_type,2020-03-29 08:06:15,Tesla announced today that it will officially shut down its Fremont factory and Gigafactory New York starting on Ma https://t.co/xFIDcaRtdf,-0.006397306397306411,0.28114478114478114,0.13737373737373737
result_type,2020-03-29 08:03:12,"$TSLA in -4.62% Downtrend, sliding for three consecutive days on March 27, 2020. View odds for this and other indic https://t.co/g6XM3Xpm7E",-0.125,0.375,0.125
result_type,2020-03-29 08:01:14,"#coronavirus next step: credit crisis. Great content. FOR #Tesla fans, Ford has huge trouble due to large debt. FYI #Tesla h",0.18154761904761907,0.4422619047619047,0.3119047619047619
result_type,2020-03-29 07:57:24,E se #Tesla realizzasse una #Model3 station wagon All Road?https://t.co/oHXOhuhH6j#ElectricVehicles #guidaautonoma #S,0.0,0.0,0.0
result_type,2020-03-29 07:52:58,"So #Tesla is giving all the ventilators away for free, which they already bought and imported and shipped to where they are need",0.4,0.8,0.6000000000000001
result_type,2020-03-29 07:50:17,Volkswagen ID.3 Cost Compared With Combustion Engine Car https://t.co/JUPlQXdG4u #ElectricVehicles #Tesla #EV https://t.co/mRpvHSqlzB,0.0,0.0,0.0
result_type,2020-03-29 07:50:16,VW I.D. 4 Spied In Sweden With Opel Grille Isnt Fooling Anyone https://t.co/E3iwZQCvGV #ElectricVehicles #Tesla https://t.co/BJfWKCHcNn,0.0,0.0,0.0
result_type,2020-03-29 07:50:16,"Watch Parked Tesla With Kid Inside Slide Backward, Crash On Its Own https://t.co/ucs0wiLfJK #ElectricVehicles https://t.co/Ocb4Cg9gGO",0.6,1.0,0.8
result_type,2020-03-29 07:50:15,See How Tesla Autopilot HW3 Vastly Improves TeslaCam Video Quality https://t.co/nLnrwUdTwq #ElectricVehicles #Tesla https://t.co/YxpJrhDgYR,0.0,1.0,0.5
result_type,2020-03-29 07:50:14,Tips On Using Public EV Charging During Coronavirus Outbreak https://t.co/uPN10spzqG #ElectricVehicles #Tesla #EV https://t.co/r5agzAN8fM,0.0,0.06666666666666667,0.03333333333333333
result_type,2020-03-29 07:50:14,Tesla Cybertruck: Top 10 Countries Ranked By Percent Of Reservations https://t.co/ID0lqYfMN4 #ElectricVehicles https://t.co/FcY5PFSOvU,0.5,0.5,0.5
result_type,2020-03-29 07:50:13,This Documentary Tells Tesla's Story From Bull &amp; Bear Perspectives https://t.co/wCrvP5fQQZ #ElectricVehicles #Tesla https://t.co/liIQmcdkoO,0.0,0.0,0.0
result_type,2020-03-29 07:50:13,All-Electric NASA X-57 Maxwell Shown In New Concept Images https://t.co/XBVKTm1ZJZ #ElectricVehicles #Tesla #EV https://t.co/Y3Dopc6t2U,0.13636363636363635,0.45454545454545453,0.2954545454545454
result_type,2020-03-29 07:50:13,New Ford Mustang Mach-E Video Reveals Redesigned Door Handles https://t.co/5twj8KEndC #ElectricVehicles #Tesla #EV https://t.co/Czh8wnjhCv,0.13636363636363635,0.45454545454545453,0.2954545454545454
result_type,2020-03-29 07:50:12,Production Shutdown Costs Automakers More Than Building New Factories https://t.co/maQ07wqP9O #ElectricVehicles https://t.co/W6T8t88Avf,0.3181818181818182,0.4772727272727273,0.3977272727272727
result_type,2020-03-29 07:50:12,Western Europe: 7% Of New Car Registrations Were Plug-Ins YTD https://t.co/S5ZLp1bnjG #ElectricVehicles #Tesla #EV https://t.co/vgZInNEEfH,0.06818181818181818,0.22727272727272727,0.1477272727272727
result_type,2020-03-29 07:50:11,Hyundai Kona Electric Updates Could Boost Range https://t.co/jTpAwJIx38 #ElectricVehicles #Tesla #EV #Renewables https://t.co/YCtNbFQ1cM,0.0,0.0,0.0
result_type,2020-03-29 07:50:10,Renault ZOE DC Charging Test Reveals Peak Power Of 46 kW https://t.co/4oye2rGICl #ElectricVehicles #Tesla #EV https://t.co/pw2GA6JxmD,0.0,0.0,0.0
result_type,2020-03-29 07:50:10,Porsche Taycan Called 'Craziest Electric Car' By Popular Tech Reviewer https://t.co/NPJYQuV0rj #ElectricVehicles https://t.co/mceuh9kDUq,0.6,0.9,0.75
result_type,2020-03-29 07:41:39,@elonmusk how many likes or retweets to have your company (Tesla) or to get a Tesla for free #giveaways #Tesla #teslaqu,0.45,0.65,0.55
result_type,2020-03-29 07:40:24,#Ganfeng They understood so many years back - in the early 2000s - that #lithium would be driving all of the green https://t.co/nkTjq5qPXA,0.09999999999999999,0.275,0.1875
result_type,2020-03-29 07:38:29,"So #Tesla is giving all the ventilators away for free, which they already bought and imported and shipped to where they are need",0.4,0.8,0.6000000000000001
result_type,2020-03-29 07:36:46,"Good news: #Ford, #Tesla and other automakers are being given go-ahead to make ventilators. Our country needs themwe must",0.2875,0.48750000000000004,0.3875
result_type,2020-03-29 07:35:40,"In this episode of #RideNewsNow with Alison Haislip, tape can trick a #Tesla, cheap gas hurts #EV sales, and batter https://t.co/ZtYifWgFou",0.4,0.7,0.55
result_type,2020-03-29 07:35:21,"So #Tesla is giving all the ventilators away for free, which they already bought and imported and shipped to where they are need",0.4,0.8,0.6000000000000001
result_type,2020-03-29 07:35:18,"So #Tesla is giving all the ventilators away for free, which they already bought and imported and shipped to where they are need",0.4,0.8,0.6000000000000001
result_type,2020-03-29 07:34:11,The Corona Convoy at Anthony Henday #COVID19AB #tesla #tocalberta https://t.co/0dYJDniuyL,0.0,0.0,0.0
result_type,2020-03-29 07:33:37,Tesla Cybertruck Wins The Hearts Of Customers Around The World  $TSLA #Tesla #Cybertruck https://t.co/aL43IAAWEj,0.3,0.2,0.25
result_type,2020-03-29 07:32:06,"Hey @elonmusk how is your idea for the electric jet going? It has been 10 years or so, you have to be close to laun https://t.co/siDa46iAyi",0.0,0.0,0.0
result_type,2020-03-29 07:31:52,@elonmusk how many likes or retweets to have your company (Tesla) or to get a Tesla for free #giveaways #Tesla #teslaqu,0.45,0.65,0.55
result_type,2020-03-29 07:28:16,@elonmusk how many likes or retweets to have your company (Tesla) or to get a Tesla for free #giveaways #Tesla #teslaqu,0.45,0.65,0.55
result_type,2020-03-29 07:27:26,@elonmusk how many likes or retweets to have your company (Tesla) or to get a Tesla for free #giveaways #Tesla #teslaqualityissues #Elonmusk,0.45,0.65,0.55
result_type,2020-03-29 07:27:08,100% solar powered cup of coffee!.... #solar #vanlife #oceanbeach #solarpower #tesla https://t.co/eq4Ax5TXBh,0.0,0.0,0.0
result_type,2020-03-29 07:26:25,"So #Tesla is giving all the ventilators away for free, which they already bought and imported and shipped to where they are need",0.4,0.8,0.6000000000000001
result_type,2020-03-29 07:24:36,Tesla Cybertruck Wins The Hearts Of Customers Around The World  $TSLA #Tesla #Cybertruck https://t.co/aL43IAAWEj,0.3,0.2,0.25
result_type,2020-03-29 07:19:52,On the road to nowhere... #TheDigitalCoach #Brisbane #WeekendVibes #CoronaLockdown #COVID19 #Tesla #Model3Au #AI #Data,0.0,0.0,0.0
result_type,2020-03-29 07:19:24,Today is delivery day and our #Model3 dual motor is here! The long wait is over and we absolutely love it. Taking delivery was,0.225,0.5,0.3625
result_type,2020-03-29 07:18:24,Very happy Tesla owner... @elonmusk#TheDigitalCoach #Brisbane #WeekendVibes #CoronaLockdown #COVID19 #Tesla #Model3Au,1.0,1.0,1.0
result_type,2020-03-29 07:18:20,Very happy Tesla owner... @elonmusk#TheDigitalCoach #Brisbane #WeekendVibes #CoronaLockdown #COVID19 #Tesla #Model3Au,1.0,1.0,1.0
result_type,2020-03-29 07:17:28,2020 Fiat 500e  All-New &amp; Electric Only (Gallery) https://t.co/ZKAa3bl27L #Tesla #EV #ClimateChange #Renewables #RenewableEnergy,0.0,1.0,0.5
result_type,2020-03-29 07:17:27,"Wanted  100,000 Ventilators In 13 Days https://t.co/Z7RCnkbPDT #Tesla #EV #ClimateChange #Renewables #RenewableEnergy",0.0,0.0,0.0
result_type,2020-03-29 07:17:26,Volkswagen Software  10 Months Ago vs. Today https://t.co/8Nrrm7OqNh #Tesla #EV #ClimateChange #Renewables #RenewableEnergy,0.0,0.0,0.0
result_type,2020-03-29 07:17:26,Heres How One Teenager is Taking A Stand Against Car Idling https://t.co/1rPaQuj0AT #Tesla #EV #ClimateChange #Renewables #RenewableEnergy,0.0,0.0,0.0
result_type,2020-03-29 07:17:25,Check Out This Electric Vehicle Total Cost Of Ownership Calculator https://t.co/k9SoujF4YR #Tesla #EV https://t.co/moqqRplK4F,0.0,0.75,0.375
result_type,2020-03-29 07:17:24,Why Have Carbon Dioxide Levels Shot Up More In Recent Decades Than Ever Before? https://t.co/20OyXsPzyS #Tesla #EV https://t.co/5eqTXN7Ff7,0.25,0.375,0.3125
result_type,2020-03-29 07:17:24,Off-The-Radar Renewable Energy Explosion After COVID-19 Dust Settles  CleanTechnica Interview https://t.co/ZPN8wcb8RU,0.0,0.0,0.0
result_type,2020-03-29 07:17:23,A Guide To Disaster Preparedness  Coronavirus Edition: Time Management https://t.co/lB2k03tYOb #Tesla #EV https://t.co/5yWHJXLgBi,0.0,0.0,0.0
result_type,2020-03-29 07:17:19,Toilet humour...but only in Australia #TheDigitalCoach #Brisbane #WeekendVibes #CoronaLockdown #COVID19 #Tesla #Model,-0.016666666666666666,0.5,0.24166666666666667
result_type,2020-03-29 07:15:48,Stunning Queensland countryside...#TheDigitalCoach #Brisbane #WeekendVibes #CoronaLockdown #COVID19 #Tesla #Model3Au #A,0.5,1.0,0.75
result_type,2020-03-29 07:14:59,"According to Reuters, #Tesla plans to cut its staff at its #Nevada battery factory by about 75%.#Panasonic, its Jap https://t.co/pVl1z0y0V1",0.0,0.0,0.0
result_type,2020-03-29 07:09:56,"This is my Tesla. There are many like it, but this one is mine. .  #Tesla @28delayslater  @thirdrowtesla https://t.c",0.5,0.5,0.5
result_type,2020-03-29 07:03:50,The Corona Convoy at Anthony Henday #COVID19AB #tesla #tocalberta https://t.co/0dYJDniuyL,0.0,0.0,0.0
result_type,2020-03-29 07:03:43,Nikola Tesla is a saint in my Church of Quantum Taoist Science and NeoGnostic Shamanic therapy.  It's a working title. #te,0.0,0.0,0.0
result_type,2020-03-29 07:03:42,Tesla Cybertruck Wins The Hearts Of Customers Around The World  $TSLA #Tesla #Cybertruck https://t.co/aL43IAAWEj,0.3,0.2,0.25
result_type,2020-03-29 07:01:22,#Tesla  video hints that a new autopilot feature will enable cars to automatically stop at traffic lightshttps://t.co/PhsehdCobt,0.13636363636363635,0.45454545454545453,0.2954545454545454
result_type,2020-03-29 07:00:46,"So #Tesla is giving all the ventilators away for free, which they already bought and imported and shipped to where they are need",0.4,0.8,0.6000000000000001
result_type,2020-03-29 07:00:03,E se #Tesla realizzasse una #Model3 station wagon All Road?https://t.co/oHXOhuhH6j#ElectricVehicles #guidaautonoma #S,0.0,0.0,0.0
result_type,2020-03-29 06:58:50,Interesting find by a Model Y owner. Pins &amp; holes for the badge - probably to ensure straight logo and ease of application.,0.35,0.45,0.4
result_type,2020-03-29 06:56:20,@elonmusk Can you add a better authentication process for my Tesla account? What if I want to use 3rd party apps t https://t.co/Be1LvcwXzX,0.25,0.25,0.25
result_type,2020-03-29 06:55:13,Hey worldIt's been exactly 2 months since I asked the last timeWho's planning to get a battery electric car?+ reply,0.125,0.15833333333333333,0.14166666666666666
result_type,2020-03-29 06:55:06,"The performance of my investment account after the autonomy day when I decided to go all in on $TSLA.    Yes, I hav https://t.co/RRpkg5l3fs",0.0,0.0,0.0
result_type,2020-03-29 06:52:57,I live the CBD... #TheDigitalCoach #Brisbane #WeekendVibes #CoronaLockdown #COVID19 #Tesla #Model3Au #AI #DataScience,0.13636363636363635,0.5,0.3181818181818182
result_type,2020-03-29 06:49:12,"So #Tesla is giving all the ventilators away for free, which they already bought and imported and shipped to where they are need",0.4,0.8,0.6000000000000001
result_type,2020-03-29 06:48:59,"So #Tesla is giving all the ventilators away for free, which they already bought and imported and shipped to where they are need",0.4,0.8,0.6000000000000001
result_type,2020-03-29 06:48:05,"@elonmusk proud model 3 owner and resident physician working at SUNY downstate in brooklyn, NYC which was just declared a COV",0.8,1.0,0.9
result_type,2020-03-29 06:43:08,"@elonmusk proud model 3 owner and resident physician working at SUNY downstate in brooklyn, NYC which was just declared a COV",0.8,1.0,0.9
result_type,2020-03-29 06:40:05,"What questions would you like us to ask on our next @thirdrowtesla podcast? Topic is the ""Future of #Tesla"".",0.0,0.0625,0.03125
result_type,2020-03-29 06:36:17,NEW https://t.co/39tSEXoPFI - daily published!    https://t.co/vGNVOEpiv7 Merci @formel1_DE @thedrive @ChargedEVs #carscoops #tesla,0.06818181818181818,0.22727272727272727,0.1477272727272727
result_type,2020-03-29 06:35:48,#Tesla #Autopilot stopping for red lights for the first time. https://t.co/M0zkiqyypl,0.125,0.16666666666666666,0.14583333333333331
result_type,2020-03-29 06:34:15,"What questions would you like us to ask on our next @thirdrowtesla podcast? Topic is the ""Future of #Tesla"".",0.0,0.0625,0.03125
